{
  "type": "presales-site",
  "title": "SmokeSite",
  "project": "smokesite",
  "subtitle": "建站方案与报价",
  "version": "1.0",
  "status": "draft",
  "audience": "external",
  "brand": "cyberklick",
  "language": "zh-CN",
  "owner": "presales-orchestrator（冒烟测试场景）",
  "reviewers": [],
  "related_docs": [],
  "revision_history": [
    {
      "version": "v1.0",
      "date": "2026-09-15",
      "author": "presales-orchestrator",
      "summary": "样张取自 presales-orchestrator/tests/smoke.py 的 SmokeSite 场景（同店改版双方案），非真实客户，仅用于验证类型包渲染与质检链路"
    }
  ],
  "lark_folder": {
    "pending_reason": "本样张不发布，仅用于类型包回归 golden，不申请 token",
    "path": "N/A（本样张不发布，仅作类型包回归 golden）"
  },
  "extra": {
    "note": "本样张字段与内容改编自 ~/.claude/skills/presales-orchestrator/tests/smoke.py 的 site() 函数与 ~/.claude/skills/presales-pricing/tests/fixtures/waykar-site-input.json 定价结构，客户名沿用冒烟测试的占位名 SmokeSite，不指代任何真实客户"
  }
}
