{
  "type": "test-report",
  "title": "会员积分系统 v2",
  "project": "membership-points-v2",
  "subtitle": "测试报告",
  "version": "1.0",
  "status": "approved",
  "audience": "internal",
  "brand": "internal",
  "language": "zh-CN",
  "owner": "刘洋（测试）",
  "reviewers": [
    "王敏（研发）",
    "陈立（产品）",
    "李强（架构组）"
  ],
  "related_docs": [
    {
      "type": "test-plan",
      "role": "executes_plan",
      "title": "会员积分系统 v2 测试计划",
      "path": "../../../test-plan/samples/membership-points-v2/doc.json"
    },
    {
      "type": "test-cases",
      "role": "reports_on",
      "title": "会员积分系统 v2 测试用例",
      "path": "../../../test-cases/samples/membership-points-v2/doc.json"
    }
  ],
  "revision_history": [
    {
      "version": "v1.0",
      "date": "2026-08-20",
      "author": "刘洋",
      "summary": "初版，功能/接口/并发测试执行完毕，评审通过"
    }
  ],
  "lark_folder": {
    "pending_reason": "样张不发布，尚未申请飞书目录 token",
    "path": "内部产品文档/会员积分系统 v2/测试报告"
  }
}
