{
  "type": "test-plan",
  "title": "会员积分系统 v2",
  "project": "membership-points-v2",
  "subtitle": "测试计划",
  "version": "1.0",
  "status": "approved",
  "audience": "internal",
  "brand": "internal",
  "language": "zh-CN",
  "owner": "刘洋（测试）",
  "reviewers": [
    "王敏（研发）",
    "陈立（产品）"
  ],
  "related_docs": [
    {
      "type": "prd",
      "role": "source_prd",
      "title": "会员积分系统 v2 产品需求文档",
      "path": "../../../prd/samples/membership-points-v2/doc.json"
    },
    {
      "type": "tech-spec",
      "role": "source_spec",
      "title": "会员积分系统 v2 技术方案设计",
      "path": "../../../tech-spec/samples/membership-points-v2/doc.json"
    },
    {
      "type": "test-cases",
      "role": "references",
      "title": "会员积分系统 v2 测试用例",
      "path": "../../../test-cases/samples/membership-points-v2/doc.json"
    },
    {
      "type": "test-report",
      "role": "references",
      "title": "会员积分系统 v2 测试报告",
      "path": "../../../test-report/samples/membership-points-v2/doc.json"
    }
  ],
  "revision_history": [
    {
      "version": "v1.0",
      "date": "2026-08-12",
      "author": "刘洋",
      "summary": "初版，评审通过"
    }
  ],
  "lark_folder": {
    "pending_reason": "样张不发布，尚未申请飞书目录 token",
    "path": "内部产品文档/会员积分系统 v2/测试计划"
  }
}
